title,content,poster_path,cluster
Super Machi,"Super Machi Drama, Mystery, Romance A humble middle class singer in his 20s get pursued by a beautiful woman who claims to be a girl friend whereas he hasn't seen that women in her life before. Things get mysterious and much complicated as he learns she officially registered herself as his wife without his knowledge.. te",/wQAyybjuXoJ6uLwZ8GLXtvG3fF8.jpg,6
Mishan Impossible,"Mishan Impossible Thriller, Comedy Three little kids from Vadamalapeta want to hunt down Dawood Ibrahim and claim prize money. An investigative reporter and her sidekicks want to bring down a child trafficking nexus. How does this motley crew cross paths? te",/2uUectWqZTzpTtfwq4hGeY5v2l1.jpg,7
Atithi Devobhava,"Atithi Devobhava Drama, Romance Abhay, a software employee, has mono-phobia since his childhood, falls in love with Vaishali. He also fears to tell her about his phobia as she may not understand him. A night where he has to spend alone leads to many problems. te",/k1eUqOyh0sF9V89UgLvPei5Q8zz.jpg,4
Merry Christmas,"Merry Christmas Drama, Mystery, Thriller A Christmas Eve encounter between two enigmatic strangers sparks a poignant connection - but a dark turn of events threatens to expose their murky past. hi",/zF3cqcT8OlDTcKIFAoXVK1gO9qW.jpg,7
A.R.M - Ajayante Randam Moshanam,"A.R.M - Ajayante Randam Moshanam Action, Adventure, Drama Set in the Northern Kerala in 1900, 1950 and 1990, Three generations of heroes Maniyan, Kunjikelu and Ajayan, try to protect the most important treasure of the Land. ml",/OClpEeRlHK3DrFO7QtWXtpDIOK.jpg,11
Tees Maar Khan,"Tees Maar Khan Action, Thriller Tees Maar Khan, a college student, dreams of joining the police force and his hard work pays off when he joins the force. Soon, Tees Maar Khan starts facing troubles from an influential person who collaborates with a mafia don and his sister and brother-in-law are murdered. te",/tTAB1D6A7w1eyao6mCf2TEn9GyK.jpg,3
Romantic,Romantic Romance Vasco De Gama Alberto and Monica are youngsters oh-so-in-love with each other. The only problem? Vasco is a wanted gangster. te,/2j1Qo6ROjbCTZCXrlhu04IogcFZ.jpg,4
Manchi Rojulochaie,"Manchi Rojulochaie Family, Comedy, Romance A young lady, who is in a live-in relationship with the man she loves, has to deal with an obsessive, controlling father who takes pride in the way he raises his daughter. How the two youngsters manage to convince him about and accept their love for each other forms the crux of the story. te",/bVtHOP1oCePnS5FX6XhJ67p0Djg.jpg,6
Malli Modalaindi,"Malli Modalaindi Family, Comedy, Romance After their divorce, Vikram starts dating Nisha’s divorce lawyer, Pavithra. But can Vikram handle the situation when his newfound casual love turns serious? te",/rUQnrbgt9VbEu9YJXq73tpjfddI.jpg,6
Bekhudi,"Bekhudi Romance, Thriller A rich boy, Abhishek, falls for Sanya, who has a dark past. Will he manage to keep his cool after listening to various people describing various incidents about her life? hi",/wdbpcrb89FREWzJCj2M1uobDRQW.jpg,7
Macherla Niyojakavargam,"Macherla Niyojakavargam Thriller, Action Siddhu is an IAS officer who is waiting for his posting in AP. In the meantime, he falls in love with Swathi, who hails from Macherla and has issues with Rajappa. Things get heated up when Siddhu gets posted in Macherla. te",/xADPZyP9ThxUacrrQi0nqGLzmUT.jpg,4
Family Drama,"Family Drama Drama, Thriller, Crime Rama and Lakshman want to take back control of their lives from their abusive father. What follows is a series of events that no one foresees. te",/dgaZiuPjHMKdFABVCfJPDa3hUdL.jpg,10
Yennanga Sir Unga Sattam,"Yennanga Sir Unga Sattam Drama, Comedy A youngster wants to get by in life without putting in any work. Two interviews that happen in different places shine a light on the caste and class differences in our society. ta",/vaICzM7ORxCE38lfQIuJR6ovKhW.jpg,7
Anandham Vilayadum Veedu,"Anandham Vilayadum Veedu Family, Romance, Action Two half-brothers decide to build a house in which they can live together with their respective brothers and families, but an evil man plots to create a rift between the families. ta",/5m8aceyEGpawiJzOChYBLJUhCUr.jpg,10
Bimbisara,"Bimbisara Action, Fantasy, Drama Bimbisara is a ruthless emperor of Trigarthala in 500 BC. In unexpected circumstances, Bimbisara travels in time and reaches the current day not knowing that a power-thirsty doctor Subramanya Sastry and Kethu are already waiting for him to come. Bimbisara has to deal with modern day hustle and bustle. te",/imy0RTW2xGZNF0SCY3jf672VQmP.jpg,7
Adbhutham,"Adbhutham Romance, Drama A boy and a girl ending up using the same phone number without each other's knowledge. What will be the consequences of this situation? will they be pleasant? te",/mDaBilIfuY6v6V2xMvAdFkozoza.jpg,6
3:33,"3:33 Horror, Thriller A young man is haunted by a number, which happens to be the time he was born at. Can he and his family escape its clutches? ta",/22S7OBQlcTNa3PdxKrjcVcH1WWG.jpg,5
4 Sorry,4 Sorry Drama An Anthology Drama film with 4 different situations with 4 different plots which involves emotion and feelings. ta,/aaHO0uhE6Xmt0LmG7SiKUeeIz3Y.jpg,7
Tathagat,"Tathagat Drama Set in the meditative quietude of a Himalayan village, Tathagat is a poetically shot tale of guilt. Following the journey of a monk questioning his renunciation, this philosophical drama takes a thought-provoking look at the relationship between our childhood memories and adulthood perplexities. hi",/eVAyhSiDpf5V20qetngvLTlQ3iX.jpg,7
Chattambi,"Chattambi Drama, Thriller Set in 1995, Chattambi follows the lives of abrasive outlaws in rural Idukki. When Kariah feels he is being excluded from the clan, he decides to lead his life on his own terms without realizing the grave consequences of his decision. ml",/kLt6fdYP2W5ZNoX9YvjLF5sw1eB.jpg,7
Paayum Oli Nee Yenakku,"Paayum Oli Nee Yenakku Thriller, Romance, Action A man with partial blindness embarks on a journey to solve the mystery behind his father's death and uncovers a sinister political conspiracy. ta",/wR07XZNsWmPGFvitMN1zSk7gFbk.jpg,3
Cash,"Cash Comedy, Drama Armaan, a 25-year old middle-class boy has an ambition of becoming India’s Elon Musk. On the day when the government announces demonetization, Armaan takes on the near-impossible task of laundering 5 crores of “dirty” money in less than 52 days before the banks stop accepting old notes,  along with his buddy Soda and a crooked real estate agent, Neha. But soon, hot on his heels are politicians, their minions, and a compulsively punctual dabbawala-turned-cop. hi",/9Yj4CnkDhkFbx4DxJifjOSMceqE.jpg,7
Tiger Nageswara Rao,"Tiger Nageswara Rao History, Action Based on the life of the notorious thief Nageswara Rao, who was the most wanted thief of south India& managed to evade the authorities on several occasions in the 1970s, earning him the moniker of 'Tiger.' te",/3tiYpneYIvXfbaCE0brOoBjXP7v.jpg,7
Randu,Randu Comedy Randu is a socio-political satire that hilariously portrays how the quite normal life of a village youth namely Vava is disturbed by the acts of some communal groups in the village. The current social atmosphere and political events add to his challenges. Can he make things straight through his wit and innocence? ml,/hZV7RFihxEqrX3T9GbLqtaTwrGh.jpg,7
No Man's Land,"No Man's Land Drama, Crime Working as a housekeeper and escort, Sumitra finds solace in alcohol. One day, a duo rents a room in the resort she works at, cold-blooded murder is committed. Considering it a mistake, she puts it behind her and lives peacefully till a police officer, Ahmed, arrives to investigate the missing duo. ml",/srRnPI43ZJgvvlgtuEsoei7CUxo.jpg,2
Vanam,"Vanam Thriller, Mystery, Horror An art college student tries to find the reasons behind the mysterious deaths of the people who have stayed in a hostel room, with help from a documentary filmmaker. ta",/3Ez3alwvA3iEvIAMC9yr47jJaTc.jpg,8
Meow,"Meow Drama, Comedy Follows Dasthakeer and Sulekha, a married couple that moves to Dubai with their three children for a better living. ml",/mZCp9z5LCrMCTSnjmHuyBQ8k8aW.jpg,7
Devil,"Devil Action, History, Thriller, Mystery A British secret agent takes up the job of solving a dark mystery. He is led into a web of love, deceit and betrayal. His success and failure can change the course of history. te",/sF3CTnQlVypKJnXbdL0CurjZmym.jpg,3
Marutha,"Marutha Family, Romance Two families are torn apart by the custom of seimurai, practised in Madurai. ta",/bxIdlXFI3GskAtfwe9R1eK34QIs.jpg,10
Baby,"Baby Romance, Drama A pair of high school sweethearts face challenges in their relationship when they take different directions in life. te",/cr74IPXOmqEgJMZ0yRppIuQvyqU.jpg,6
Jayamma Panchayathi,"Jayamma Panchayathi Drama, Comedy A fierce Jayamma hails from a well off family but she needs funds for her husband’s heart surgery. Will she manage to get what she seeks? te",/7YaK8gaAInlBizx0BDkZ7piKVH9.jpg,10
Rowdy Boys,"Rowdy Boys Action, Romance Akshay, an engineering student, does everything on impulse, falls for Kavya (a bright medico) at first sight. Due to an incident in her college, Kavya decides to begin a live-in relationship with Akshay. Her classmate Vikram (Vikram Saahidev), who admires her, vows not to remain silent. te",/lBKARvSBWkaHrbYg8qhyL2zwREc.jpg,6
18 Pages,"18 Pages Romance When a heartbroken Siddhu stumbles upon a two-year-old diary, he finds himself drawn into the enigmatic world of a young woman named Nandini and falls for her. te",/d6SdWIh7gY6x84isJkfrD9SNiJ7.jpg,5
Karthikeya 2,"Karthikeya 2 Mystery, Adventure, Thriller, Action Before the Kalyug begins, Lord Krishna hands over an anklet that holds the answer to all of world’s miseries. Years later a doctor finds himself in the thick of things when the pursuit for the anklet carries on. A doctor with a curious mind, Karthikeya, aka Karthik, believes in pursuing the truth. The quest leads Karthik to discover the power of the ancient Indian belief system and the essence of Krishna. te",/fKKoQndNfbDOLfYM1Zogt7miGF1.jpg,11
Sita Ramam,"Sita Ramam History, Romance, Drama Afreen, a rebellious Pakistani student sets ablaze the car of an Indian in London. Angered Afreen returns to Pakistan to ask for money from her grandfather that she has to pay in a month's time as damages. However, she gets to know that he is no more and the only thing he has left for her is a letter-delivering task, written by Ram to Sita. As Afreen sets out to find Ram, there begins her journey of discovering the secret behind the 20-year-old letter. te",/t1O94ZBzsQXJihtVkrsStRLyUDR.jpg,7
Udumbu,"Udumbu Action, Drama Simittu Ani, who is married to Hima, works for Bharathan, a notorious man who is involved in anti-social activities. Ani's life takes a dramatic turn when he is held guilty of murder. ml",/djeofABsuGo2KzOfJ2BYrF8BKUs.jpg,7
Don,"Don Comedy, Romance A youngster who is still figuring out what his passion is gets into an engineering college where he clashes with a disciplinarian faculty. ta",/fbh3maleH24FiSGlTKvoVVe0txC.jpg,6
Sabhaapathy,Sabhaapathy Comedy A young man who has a speech disorder ends up with a suitcase filled with money that belongs to a corrupt politician. ta,/hGimsV6wpwBygmmP1mN23gqfoiV.jpg,5
Virgin Story,"Virgin Story Romance, Comedy In the present world of less attention span and instant gratification, can the time consuming emotion of love survive or fade away. te",/lFmjAAKZAbU5oRmORRqfUfeAfrW.jpg,9
Keedam,"Keedam Crime, Thriller Radhika Balan, a smart cyber-security expert, advocates the use of the technology for the good but her life is turned upside down when she falls prey to a cyber-stalking incident and her privacy gets compromised ml",/oc47AJXpj7Kof6Hqi7fNfMkfNy0.jpg,3
Ori Devuda..!,"Ori Devuda..! Comedy, Romance Two childhood friends, Anu and Arjun, decide to get married. However, their marital life becomes complicated due to misunderstandings and miscommunication which leads to a divorce. te",/3sdQDyUYDpSFIGd9UetguWV4yRY.jpg,6
Padmini,"Padmini Romance, Comedy, Drama Rameshan, a lecturer and part-time poet, becomes the laughing stock of the village after his wife runs away on the wedding night. When he tries to overcome these taunts and win a second chance at love, he faces an uphill legal battle and toxicity of the society. ml",/dH5T9iztaJZ0NZDWiOOJfwzxUXI.jpg,9
The Rose Villa,"The Rose Villa Horror, Thriller Ravi and Sweta meet a lonely elderly couple when their car breaks down in the forest. Invited to their home, strange behaviour sets off alarm bells and Ravi and Sweta attempt to escape. te",/zybJ5VEgM7HNvMjbsSrpTc36sgA.jpg,8
Cobalt Blue,"Cobalt Blue Romance, Drama When an aspiring author and his free-spirited sister both fall for the enigmatic paying guest at their home, ensuing events rock their traditional family. hi",/59CjIDHHvNyiinRwaSIouWnPNrY.jpg,6
Chhatriwali,"Chhatriwali Comedy, Drama Sanya is an unemployed chemistry genius looking for a job. However, she also wants to use her knowledge of chemistry to help young minds move beyond the taboos of sex with the right education. hi",/yj6QBEx3QMMxfz5AqDtFEgvlfSb.jpg,7
A Thursday,"A Thursday Thriller, Crime, Drama When a kindergarten teacher takes her 16 students hostage and makes a set of demands, it not only rattles the Mumbai police and the city but also sends shockwaves through the country and its leaders as the motive behind the hostage situation is unearthed. hi",/xnoyG3rPuKAHeRbNlwuyiC08Sya.jpg,3
Ram Asur,"Ram Asur Science Fiction, Thriller Ram tries to make a synthetic diamond but fails most of the time, leading to scars in his relationship with Priya.  Through a friend, Ram meets priest called Ramachari, who in turn asks Ram to meet Suri. Ram’s life changes after meeting Suri. te",/c8mvznqYPz5XztVHiiYcoF0bphX.jpg,1
Chanakya (Short Film),Chanakya (Short Film) Drama Chanakya is an art form that inspires today's young generation. It shows that the younger generation must face the situation without giving up. hi,/4bVIxFZtot2ZHirJ1GzeCZnag1e.jpg,7
CLAUSTROPHOBIA,"CLAUSTROPHOBIA Drama A person who intense, excessive and persistent worry and fear about everyday situations. ml",/ihAdsz4RcGlZVX5lHbR73GJ1L6k.jpg,7
Kolai,"Kolai Crime, Thriller, Mystery When a famous model gets killed, a smart detective comes to investigate when he realizes this incident calls him to a mystery. ta",/lblx8zvMF0NxX62aOGocyOhvDld.jpg,2
Highway,"Highway Thriller, Crime A serial killer is on the loose, a frustrated cop is hot on his heels and a pair of young lovers happen to find themselves in midst of it all. te",/tY9JD5L6JHn6NptN1BBjSf2cIiy.jpg,3
Meppadiyan,"Meppadiyan Drama, Thriller While there is an old-fashioned feel to the story telling, it moves along new paths that are twisted enough to keep us interested and also has us clenching our fists. ml",/jNnxZxS8CDfQLQDYSm2il8RPvpI.jpg,7
Velle,"Velle Comedy, Crime Rishi is a writer/director who is narrating a script close to his heart to Rohini - possibly the lead protagonist of his film. As he begins his narration, we step into the world of Rahul, Riya, Rambo and Raju - four friends living their best days amusing people with childish shenanigans in school.  These four ""Vellas"" are complete and content with each other's company and couldn't care less about the world around them until life hits them in the face. An enthralling script narration on one end, and four immature kids trying to correct a plan gone wrong on the other - Velle is about laughter, friendships, frenzy and the unpredictability of life. hi",/uhq3hWo4KwkoXb4BJ0sixZEWCn9.jpg,7
Iravatham,"Iravatham Thriller, Mystery A mysterious white camera turns a beautician's life into a waking nightmare, especially when she watches herself dying in the videos shoots with it. te",/2OCZWu1rnhonkW142xmSIwzXaFs.jpg,3
Connect,"Connect Horror, Thriller The announcement of a nation-wide lock-down due to the spread of COVID-19 pandemic disrupts the peace of a family. What follows is a series of bizarre events as one of them tries to invite the spirit of a family member. ta",/arWsiqz1ZzFCVKqNDJlQ8RXfR2n.jpg,8
Yodha,"Yodha Action, Thriller When terrorists hijack a passenger plane, a suspended commando onboard under mysterious circumstances, crafts a plan to thwart the hijackers and safeguard the passengers' survival despite the engine's failure. hi",/rkCRwuWgrkGTya4vLqwFugwSqeh.jpg,3
Visithiran,"Visithiran Crime, Thriller Following the death of his ex-wife, a retired police officer, who is known for his investigative prowess, unexpectedly gets pulled into a criminal case involving organ harvesting. ta",/aN2bLSiywApPAnEv4FXXYGBxI6l.jpg,2
Singa Paarvai,"Singa Paarvai Action A woman who is undergoing police training, loses her sight in a road accident.  Her life crosses path with a serial rapist. Will her training & willpower save her from the situation? ta",/6sEVxVDxb485ghSR33DeLYSvn80.jpg,3
Solomante Theneechakal,"Solomante Theneechakal Romance, Thriller The friendship of two young women police constables, Suja and Glyna is put to test when Suja`s lover Sharath gets involved in a crime. Will their friendship stand the test of time when this murder mystery is unveiled? ml",/8OaOZ5lymaVLfITiCZ0d08Orl2I.jpg,2
Yashoda,"Yashoda Crime, Thriller, Drama, Science Fiction Looking to save her sister, Yashoda, a desperate woman agrees to be a surrogate and move in to a plush facility - but nothing is as it seems. In the world outside Eva, a Hollywood starlet dies under mysterious circumstances, so do a tycoon and a super model. An unknown drug seem to hold the key to the whole mystery. te",/gSYkMzVRBeYwBgvQ155oORPJzmW.jpg,1
Swathi Muthyam,"Swathi Muthyam Romance, Family Balamurali, a government employee, gets ready to marry Bhagyalakshmi as soon as he meets her in an arranged marriage setup. Everything goes on smoothly until there comes a day when it is revealed that the groom has fathered a child in the past. te",/mR8pmOhp4zYwwFadX8TLX5goH64.jpg,9
The Kashmir Files,"The Kashmir Files History, Drama Based on a true tragedy, the emotionally triggering film sheds light on the plight of Kashmiri Pandits (Hindus), a religious minority in the 1990s Kashmir valley, who were compelled to flee their homes by the Islamic militants. hi",/2VvjJFDBFYkVgr89BjqbUl26QyW.jpg,7
Djibouti,"Djibouti Comedy, Action Hannah, a Djiboutian girl visits Kerala. She becomes friends with Loui and Aby who are living in Idukki district of Kerala. She arranges job for her friends in Djibouti, an African country. The problems faced by them there and how they plan to escape to their hometown becomes the premise of the movie. ml",/cVvzLCyTmijhh7FxZIV0SvViLrl.jpg,7
The Bengal Files,"The Bengal Files Drama, History, Thriller A criminal investigator uncovers a web of corruption during a missing person investigation, while a figure connected to the case reflects on the communal violence which broke out ahead of India's partition. hi",/3gbZh1S735CLz7NwFRb7bycUWkP.jpg,2
Veerapandiyapuram,"Veerapandiyapuram Action, Drama An orphan murders his girlfriend's father and his brothers. What made him seek out this bloody revenge? ta",/wWhcKIMdgu2s01yqWEKmqaKI6CI.jpg,3
Chithirai Sevvaanam,"Chithirai Sevvaanam Family, Drama Muthupandi is in search of Aishwarya, his teenage daughter, who goes missing after her private video gets leaked online. Can the innocent father trace his daughter, and identify the culprits responsible for putting him in this situation? ta",/iNHZmpAoyMgxMYHfT6Uq8ZLtwSo.jpg,10
Mr. & Mrs. Mahi,"Mr. & Mrs. Mahi Drama, Romance Poles apart, Mahima and Mahendra find a unifying force in the form of cricket. While one Mahi (Mahendra) is grappling to come to terms with his dream of playing for India getting shattered, he wants to live it through the other Mahi (Mahima.) Mahima is a doctor but Mahendra hasn't seen anyone play like her. Will the clash of dreams unite Mr. and Mrs. Mahi or create boundaries for life? hi",/jnbcyRxzQbYOLSzz7OvU4pNwq42.jpg,9
Ayothi,"Ayothi Family, Drama A four member family from Ayodhya, headed by conservative, religious patriarch, Balram, his wife Janaki, daughter Shivani and son Sonu goes on a spiritual trip to Rameswaram. Things get complicated when Janki dies in an accident and the two kids endures at the hands of their fervently devout father. A Rameswaram localite, friend of the cab driver involved, with his other friend decides to help the family in returning their mother's remains to their homeland, despite all odds. ta",/em8sXeAUjNyWHEK2eG5rpYdoQfn.jpg,10
Thank You,"Thank You Romance, Drama Abhiram aka Abhi is a successful entrepreneur who calls himself ‘self-made’ and doesn’t believe anyone but himself is the reason for his success. But when he’s forced to look back on life, what does he realise? te",/8wrpCfKmeyFLSE3pOYdY5TR4kw2.jpg,6
Cauliflower,"Cauliflower Comedy, Fantasy Cauliflower is a 35-year-old Britisher who goes by the strict philosophies set by his grandfather,comes to India. One fine day, he gets raped by three girls and things change upside down for him. Upset with the rape, he files a case and seeks justice. te",/ZOMGgYfKpdatzJRczz62iEUzNZ.jpg,7
Thaggedhe Le,"Thaggedhe Le Crime, Thriller Inspector Chellappa is on the verge of busting the drug mafia in the city and waits for the right moment. Meanwhile, a corporate man gets entangled with the world of drugs and later becomes a suspect in a murder case. Simultaneously, the D-gang from Dandupalyam returns with a vengeance. te",/3TQJwWUwwGLDcD5z353PzijEfKv.jpg,2
Thunivu,"Thunivu Action, Crime, Thriller, Comedy A gang goes to rob a bank only to find that there's already a criminal mastermind holding it for ransom, but his identities and motives behind the heist remains mysterious. As they plan to collect the bounty and disappear without a trace, their crimes and their past slowly catches up with them. ta",/5Cdi9MFxEGsfphvDxV4TyY4znP6.jpg,3
Sundari Gardens,"Sundari Gardens Drama Sundari Sara Mathews, popularly known as Suma, meets Victor, the school's new English teacher and falls for him. However, before expressing her feelings to him, another teacher, Lekha, asks him out and he accepts, leaving Suma heartbroken. While at a low point in her life after losing her mother and arguing with her brother, Suma is consumed by jealousy and plots to break up Lekha and Victor to have him to herself. ml",/kt29FO3gSNZWS9jjHaRTky1I1o8.jpg,7
Andhagan,"Andhagan Crime, Thriller A piano player pretending to be visually-impaired, unwittingly becomes entangled in a number of problems as he witnesses the murder of a former film actor. ta",/ztEH7dqo35aVt4UTTdRaTRKatcK.jpg,3
Kannai Nambathe,"Kannai Nambathe Crime, Thriller, Action Arun finds himself caught up in a crime that he has no connection to whatsoever. Following his roommate's advice, he attempts to cover up the situation with cleverness. Will he be able to extricate himself from this predicament, or will he unwittingly reveal a much larger conspiracy than he ever anticipated? ta",/8dqgp5gNXYDuwM0GEz8617Rh08K.jpg,3
Nenjuku Needhi,"Nenjuku Needhi Crime, Drama, Mystery An upright city-bred IPS officer investigates a mysterious case of three missing Dalit girls in a rural part of Tamil Nadu. While two are found dead, one is missing without any trace. Can he crack the case and get hold of the culprits? ta",/tNZx007RjEdZlYs63vqMZKpECdp.jpg,2
Sammathame,"Sammathame Romance, Comedy Krishna has big dreams about marriage in the hope that his wife will fill the void left behind from his mother’s passing. But what happens when he falls for a girl who’s nothing like he dreamt of? te",/Aar0H7eLkiTFlnYwAJ7ms85gPj9.jpg,9
Maamannan,"Maamannan Drama, Thriller An MLA and his son, who are from oppressed community, are forced to stand up against the privileged, arrogant scion of a late politician, who is determined to make them bow down to him. ta",/fy2dQecqSo1iR0GxbQ1Y21MdWyw.jpg,7
Mili,"Mili Thriller Mili Naudiyal, a nursing graduate is planning to move to Canada. She takes up a job at a food outlet for the time being but her sudden disappearance without a clue leaves her loved ones in a desperate search for her in this survival drama. hi",/eJ36QCd5SPRpivJkVgZMqKyfgCz.jpg,7
Thangalaan,"Thangalaan Adventure, Action, Fantasy, History During the British rule, Thangalaan, a fierce tribal leader, and his tribe assist Lord Clement, a British General, to trace gold in their village. While searching for the gold, the villagers earn the wrath of Aarathi, an apparent sorceress, who Thangalaan sets out to stop with all his might. ta",/dAci50FwevkdWIUzQWpdz7kSKHe.jpg,11
Selfie,"Selfie Action, Thriller When Kanal, a B-grade engineering college student, finds out that his dad went on to pay a hefty amount as “donation” to get him the seat, the liquor-swigging student is introduced to the underground world of the admission racket system in colleges. ta",/7Su5HR6P73lKUZ7HJU8HmTDneXs.jpg,3
Shabaash Mithu,"Shabaash Mithu Drama, Family From child prodigy to trailblazing captain, Indian women's cricket icon Mithali Raj navigates highs and lows of professional career. A story of a young girl's determination and stance against discrimination, about her spirit, passion, courage, and her dreams. hi",/s4T4LGIRErWK7bomHFlSJirGZ4T.jpg,10
Santhosham,"Santhosham Drama Portrays the profound connection between kin, family values alongside a delicate dash of humor and an affection track that disagreement equal. ml",/r8PHuV8U8pQPTxWduVFdhR6JPu9.jpg,10
A Ranjith Cinema,"A Ranjith Cinema Thriller The movie takes you on a roller coaster ride of events that happen in Ranjith`s life and how it affects the people around him, forcing him to resolve the matter before he looses control. ml",/zSx7nwhbRfQ68JL982uBICGob6Y.jpg,7
