title,content,poster_path,cluster
Night Encounters,Night Encounters Horror The line between the supernatural and guerrilla filmmaking becomes blurred when a director chooses an abandoned hotel to shoot her horror movie. hi,/yQ1syjuyPOUEn9PppO3JitGd40F.jpg,8
Kesari Chapter 2: The Untold Story of Jallianwala Bagh,"Kesari Chapter 2: The Untold Story of Jallianwala Bagh Drama, History A dramatization of the life story of C. Sankaran Nair, the lawyer who fought for the truth behind the Jallianwala Bagh massacre. hi",/jgGSqe1YgSot6Y1zDVTVkbsZ46z.jpg,7
Chidiakhana,"Chidiakhana Drama It is a coming-of-age story of a Bihari boy who is embraced by residents of a Marathi Chawl due to his grit, imagination and especially his footballing skills. hi",/pZdDJhHTHfh174FMXvMYlgkqgE0.jpg,7
Maalai Nera Malipoo,Maalai Nera Malipoo Drama The movie is about how the global pandemic forces a prostitute to change her medium of work onto a digital platform and how her relationship with her son is affected ta,/5JQPJNIjNVxlHcx9VX5pvKUj3LQ.jpg,7
Rangabali,"Rangabali Romance, Comedy, Action Shaurya aka Show, a self-centered & attention seeking youngster moves from Rajavaram to Vizag, and falls for a brilliant medico student Sahaja at Vizag. While attempting to convince Sahaja’s father, Show faces an unique problem and new revelations about his beloved hometown. te",/aRWjzNu6HFzT3prCE3OGp4lmMC.jpg,9
Toby,"Toby Action, Thriller, Mystery, Drama An estranged man deemed to be a beast vows to break free from the evil world and transform himself for his foster daughter. kn",/duuhplJUxzKqpX54F96igKddvLW.jpg,3
Ranasthali,"Ranasthali Action Basava is a warrior consumed by vengeance, eagerly awaiting his confrontation with his enemy, Badra. te",/qkWXawttZmBwZH83nU3oogxGbHf.jpg,3
Erumbu,"Erumbu Drama, Family A boy, Muthu, by mistake loses a one-gram ring, the only gold their family possesses and goes on a mission along with his sister Pachayammal take the help of their neighbor Chittu, decide to earn some money to make up for a lost gold ring and replace it before his family returns home. ta",/uEgBO7xnsooVawxsWC1bx2j9i2Y.jpg,10
Bawaal,"Bawaal Drama, Romance, Action, History Ajay Dixit, an ordinary history teacher in a high school, enjoys mini celebrityhood in his town courtesy of the fake image he has built. He shares a strained relationship with his newly-wed wife. Circumstances force him to take a trip to Europe for the World War II trail accompanied by his wife. Will his relationship with his wife survive this trip? Will he manage to win the war within? hi",/kT0mA3kYzvl2UZGxhJnLyTUYa2z.jpg,7
Tere Ishk Mein,"Tere Ishk Mein Romance, Drama A psychology student attempts to rehabilitate a volatile young man, before evolving into a doomed romance. hi",/7FsHlW9z7gDhDE4EXAE2WcXUVQj.jpg,5
Harkara,"Harkara History, Drama A frustrated postman decides to fool innocent villagers in a ploy to get himself transferred. As he walks uphill to deliver his last letter, a wayfarer narrates to him the story of a Harkara, that instills guilt. ta",/fIwLD6e0BsoVFMS8aKoPYTlwEEp.jpg,7
Thandatti,"Thandatti Drama, Comedy A constable, takes up a case that requires him to find a pair of gold earrings that belonged to a dead woman. ta",/avhTPLXG3Gedvu5nc7nFt2eXTNy.jpg,7
Sky Force,"Sky Force Action, Thriller, War, History In the 1965 Indo-Pak War, India faces a devastating surprise attack. Wing Commander Ahuja leads a retaliatory strike, but Squadron Leader Vijaya goes missing after a heroic solo engagement against a superior enemy jet. Ahuja spends 23 years seeking the truth and uncovering a cover-up. hi",/pmtev9YTlIRDo25G7lN8dzyoszn.jpg,3
Pallavi Bakery,"Pallavi Bakery Drama, Romance, Comedy Pallavi is an independent woman who had struggling childhood and after so much of struggle she owned a Bakery (Pallavi Bakery) Adithya, a spoiled brat requested to work as her waiter in the bakery since he is not good in cooking. Eventually, both started to fall in love. Things goes well until Parvathi came into their life. Parvathi tries to manipulate Pallavi to get her secret recipe. She also creates a lot of misunderstanding between the people who is very attached with Pallavi. Will Parvathy get the secret recipe from Pallavi? How will Pallavi knows the truth? Will Pallavi and Adithya gets together? ta",/McrvWT5aN34RkcohjmrHpaonUG.jpg,9
#69 Samskar Colony,"#69 Samskar Colony Romance Koushik, a teenage boy, moves to the city with his family as a tenant in the Samskar colony where he falls in love with the landlady Vaishali, a married woman. te",/hKqjMlvTUG4JqaVVFJ8kaZe0tYC.jpg,4
Thundu,"Thundu Comedy, Drama A constable aiming for a promotion unexpectedly encounters many problems. Facing the issues with humor and compassion, he works to overcome them. ml",/lAmO3qw7k4bARLVgIHJMNMEtnmT.jpg,7
Housefull 5,"Housefull 5 Comedy, Mystery, Thriller A father writes his will — his son ""Jolly"" is going to get it all. But who is Jolly? The comedy unfolds as different people pose as the ""real"" Jolly on a cruise celebrating the father's birthday — where a murder takes place. hi",/iGvGkVOfsooO0ZBrhN5i6zXYUCy.jpg,7
CTRL,"CTRL Thriller, Drama Nella and Joe are the perfect influencer couple. But when he cheats on her, she turns to an AI app to erase him from her life — until it takes control. hi",/eCaaJkJqRA6unsVe5hvtgJq301H.jpg,7
Vil Vithai,"Vil Vithai Thriller Car driver Mithran and Swetha lose their child Bhavana to a gang of rapists. Mitran, who thinks that such an impact should not happen to any parents who bring up girls, is the plot summary of the movie ""Vill Vithai"" where the incidents of weeding out the anti-socials involved in sexual crimes.villain murders him in anger. The story of this film is written as a response to the voice of the anti authority who raised their voice against this fate of a good person who sacrificed his life considering their future welfare ta",/5KJCwpOGhnjqZ6OQXngWdYkk5hN.jpg,7
Spirit of the Mountains,"Spirit of the Mountains Documentary The charismatic Snow Leopard is the least understood of all the big cats and one of the most challenging to film. Over a period of five years, veteran Indian wildlife filmmakers, Naresh and Rajesh Bedi endured extreme cold and the thin air of the Himalayas in their daunting quest to reveal the secret lives of these elusive predators, ultimately with great success. hi",/dW89Zh6RWiEggQFG4vdAdqIQVPm.jpg,7
MAX,"MAX Action, Drama A maverick senior cop reports for duty at a new police station and soon find himself embroiled in an unexpectedly dangerous turn of events. kn",/wrkPOgbJpqCRqY0Z8cbltxLGwzl.jpg,2
The Diplomat,"The Diplomat Thriller, Drama The Deputy High Commissioner, J.P. Singh, faces an unusual crisis when a mysterious woman rushes inside the Indian High Commission in Islamabad, claiming forced marriage in Pakistan and seeking a return to India. hi",/uwl9Y4px8TTIQK4N19k6gnW1RnX.jpg,7
Rapture,"Rapture Drama In a village in Meghalaya, northeast India, several young men mysteriously disappear during the night. While the elders accuse passing strangers of kidnapping, the preacher sees the beginnings of an apocalypse lasting 40 days and 40 nights which will plunge the inhabitants of the village into darkness. Seen through the eyes of Kasan, a ten-year-old boy suffering from night blindness, the surrounding forests have never seemed so terrifying. hi",/2yBZU3qRqk88fm0TZSyXFTw9jtF.jpg,7
Whispers of Fire & Water,"Whispers of Fire & Water Drama Shiva, an audio installation artist visits the largest coal mines of Eastern India – plagued by depleting natural resources and a burning fire in his belly. However, he succumbs to the highly complex socio-political system and moves to a tribal village in the forest. There, he questions his urban view and fundamental notion of self. Water, as an element, forms the labyrinth of his quest for truth. hi",/d0rriuaoLK3YyA5oRLdzEH8KQtz.jpg,7
Aachar & Co,"Aachar & Co Family, Comedy Set against the backdrop of 1960s Bangalore, Aachar & Co. follows the journey of a traditional family as they navigate the challenges of embracing modernity while honouring their roots. The film brings together a delightful mix of nostalgia, humour, and drama, capturing the essence of that era. kn",/uMzdbb8PYgJISkw5YGjWcyWqlMa.jpg,10
Hostel Hudugaru Bekagiddare,"Hostel Hudugaru Bekagiddare Comedy When the warden of their hostel takes his own life, a group of students conspire to make it look like an accident for fear that they will be blamed. kn",/qUOYHFerIeMGrQWREX3UDrr3AaC.jpg,7
Infinity,"Infinity Crime, Thriller A series of murders happens in the city, involving a writer, a policeman, and a missing young woman, complicate things for the police department. A CBI officer takes up the case, hardly realising that he's about to unravel something more than he expected. ta",/6jaR4y8fNb3ZvR3OyERufpfmmY8.jpg,2
Ishq-e-Nadaan,"Ishq-e-Nadaan Comedy, Drama, Romance Ashutosh's life changes when he meets Ramona at the hotel, which is his work place. On the other hand, Charulata grows friends with Subhash Kapoor, a filmmaker, and shares a secret with him. What is the secret? hi",/7mXKx1rAilqmObNTHbQkmMIIahh.jpg,9
Do Patti,"Do Patti Thriller, Drama A puzzling investigation leads a no-nonsense cop down a dark path involving the vicious rivalry between twin sisters and the volatile man they both love. hi",/wbXSE68cDwqUPsHJcpdu7I5kSLK.jpg,3
Ghuspaith: Between Borders,"Ghuspaith: Between Borders Thriller, Drama An Indian photojournalist must cross the perilous border between Bangladesh and India with his family while being hunted down by Mujahideen extremists. As Manav and his family grapple with life-altering choices, ""Ghuspaith"" asks a poignant question: Where do we draw the borders between humanity? hi",/9z3G62TiHQqOR9WNUGymF2wxE8z.jpg,10
Vedaa,"Vedaa Action, Drama, Thriller A court-marshalled soldier with a traumatic past helps a young girl from 'lower' caste and an aspiring boxer work towards her dreams despite her hostile environment. hi",/wK0p210TWMH4P3isT1bI0FVEuZ9.jpg,7
The Pathan Sisters,"The Pathan Sisters Documentary Gujarat, West of India. Sofia and Suzain are two teenage sisters brought up in a humble household, taken care of by their father since their mother left. They were too young to remember, but 20 years ago, their family barely escaped the deadly 2002 Gujarat anti-Muslim riots. Refusing the grim day-to-day routine and the shadow of the past, Sofia and Suzain want to embrace life to the fullest. While they grow up, reality comes knocking. hi",/2TYJsUgrF1108yhVXMpprRpI8OF.jpg,7
Trial Period,"Trial Period Comedy, Drama A working single mother's world turns upside down when her inquisitive son demands a new father on a 30-day 'Trial Period'. hi",/kpGnnQ0zu1Utxh8F0QUgZ9d2hol.jpg,7
Oru Jaathi Jaathakam,"Oru Jaathi Jaathakam Comedy, Romance When a girl, supposedly an expert in palmistry, requests Jayesh to display his hand, he eagerly obliges. But when she tells him that this will be the worst time of his life, it surprises him. ml",/hELYemcQscoLRRTwml4BK9uYxAy.jpg,6
Premalu,"Premalu Romance, Comedy Sachin, a carefree graduate, crosses paths with Reenu, a spirited IT professional, in Hyderabad. As their friendship deepens, unspoken feelings, career ambitions and life choices challenge their bond. ml",/uPpmBjY3znUqGY8kYwI5xvOrSc0.jpg,9
O Saathiya,"O Saathiya Romance, Comedy A carefree engineering student, Arjun’s  life takes an unexpected turn when Keerthy enters his world.Just as it appears their romance is beginning to blossom, Keerthy moves out of the town, leaving Arjun in great despair. Determined to find his lost love, he embarks on a journey filled with challenges and surprises. te",/nrx02c6gASURJWkeiVzUk4oQQ4W.jpg,9
Photo,"Photo Drama The Indian government announces a nationwide lockdown without proper notice, in the wake of the pandemic. A father who is a daily wager in Bengaluru, and his 10 year-old son, decide to go back to their hometown Raichur, which is 450kms from Bengaluru. And they have to walk all the way due to the lack of transportation. The scorching heat and bad weather shakes their journey as well as both of their lives. kn",/uTW2xPRq6AhlIi2tvaWzxOG50T.jpg,7
Kalvan,"Kalvan Drama In his pursuit of employment, a reformed thief encounters a setback and seeks an elderly man who then becomes the linchpin in his journey toward a fresh start. ta",/bI0jXFPXszHjp6AB6DRVzGcQVGz.jpg,7
Eagle,"Eagle Action, Thriller A journalist pieces together the story of Eagle, a former professional sniper who falls in love with Rachana, and on a mission to redeem himself by working towards eradicating illegal arms from this world. te",/mjQN27x0Dfkmsi3SRRkAIatOr2p.jpg,4
Extra Ordinary Man,"Extra Ordinary Man Action, Drama Abhi, from his childhood, revels in the art of playing other people. His mother recognizes his extraordinary talent, propelling him into the world of acting. As he matures, he becomes a sought-after junior artist, always relegated to the background. The lines between reel and real life blur as Abhi faces a complex situation at home, with a supportive mother and a nagging and concerned father. A chance encounter with Likitha , the MD of a company, leads to love, and Abhi finds himself playing the role of a CEO. However, a conniving director presents an intriguing script, introducing Abhi to Nero, a self-absorbed and evil character with conquest on his mind. te",/bOym2XLkyDcYVvX5sZ6YYm19xXT.jpg,7
Varshangalkku Shesham,"Varshangalkku Shesham Drama, Comedy, Romance Set in the 1970s and '80s, a man of many talents and an aspiring filmmaker come together in their shared ambition of making it big in the magical world of cinema. As they struggle with a burning desire to prove themselves, can their friendship survive the test of time? ml",/dVLqE9aEszo8yrc8TDk3bloYHHS.jpg,6
Laughing Buddha,"Laughing Buddha Comedy, Drama Explores the life and personal struggles of a police head constable. kn",/mhF9LSMqr5fHqfU5i9J4VJsSTOB.jpg,7
Samara,"Samara Science Fiction, Thriller Set in Himachal Pradesh, when two murders happen in the valley, Anthony comes to the scene to investigate the killings and another team of police officials led by Senthil IPS also arrives there. Ex-military Dr. Alan is in a quest to save his infected daughter Jaani and unravels a deadly virus outbreak with officer Anthony. ml",/pn1Ce6cYs2GoXUOFyg5ZrtZ2y2T.jpg,1
Anu,"Anu Drama When a recent widow moves to New Zealand from India, she's forced to confront her grief by completing an ordinary ritual in an extraordinary circumstance: quarantine. hi",/d1sjYn3uTnHzqQzsVQM4zFBRR2v.jpg,7
Checkmate,"Checkmate Action, Comedy An assassin gets hired for a job that throws him in a murky pool of mishaps, eventually leading to a baffling secret. hi",/oMSyVJp5JT3t11ilF3CCCfH3Fwy.jpg,7
Coolie,"Coolie Action, Thriller, Crime Deva, once living a quiet life, is shaken when his close friend dies under suspicious circumstances. Determined to uncover the truth, he infiltrates a powerful gang operating in the shadows. As he investigates, Deva becomes entangled in a dangerous web of crime, betrayal, and secrets from his own past, forcing him to confront powerful enemies while protecting the ones he loves. ta",/kr36awqmziEI5mfUElsHB0pj9zP.jpg,3
DD Returns,"DD Returns Comedy, Horror Madhi and his friends hides a bag full of money and jewels in a haunted bungalow to ditch the police. When he goes to retrieve the bag, a ghost makes him play a survival game in order to leave with the bag. ta",/aautnOfweBUF74nmwRI2iSf8VdL.jpg,8
Unstoppable,"Unstoppable Comedy The story charts the journey of two childhood friends Kohinoor Kalyan and Jilani Ramdas. They are both enthusiastic and easy-going. On an unfateful day, the duo loses a heavy amount in cricket betting. They unintentionally enter the villain's traps and they end up destroying their empire. What happens when they face the villains? Is there a reason for them to get involved with the goons? te",/609tAWZ9veBNGyjfXsiltmEoScS.jpg,7
Hidimbha,"Hidimbha Thriller, Crime, Action In Hyderabad, two police officers Abhay and Adhya join forces to solve a series of kidnappings of which all the victims are girls, with one other interesting commonality. te",/6ywUJDvbvqQkE1pSQYRT9cSaVWs.jpg,2
Sync,"Sync Drama, Horror A group of friends connecting on a video call are haunted by the spirit of the girl they hit-and-run on their way back from a road trip. ta",/pOyAbMS1TEcMPkZ2cKD5NvihaJF.jpg,8
Jaane Do,"Jaane Do Romance, Drama A beautiful relationship between 2 blind people who go on a trip together. hi",/7XKdjkvq9Z2arK0DXxoEZKXRV4K.jpg,6
Web,"Web Thriller After a drunk driving accident, Abinaya, Mahashree, and Nisha wake up chained in a room by Veera, who is seeking revenge for his sister's death. Will they escape or face their fate? ta",/lU1Brm86Ez7JM16HEpH74Sxvtbd.jpg,3
Appatha,"Appatha Drama, Family, Comedy Appatha, who has spent all her life in Kaayilanpatti village, fears dogs. And in an unexpected situation, that fear turns to love. What was the reason for this transformation? ta",/npTv28pyvVI0xkXMtaZETsb4qCb.jpg,10
Maya Bazaar,"Maya Bazaar Family, Comedy, Romance After entangling in a petty conflict, two complete strangers, a guy and a girl with two extreme opposite characteristics, got themselves in a “body switch” situation. ta",/3gBHjjSb1JSOmgHCpUsXNCfI5xM.jpg,6
Stolen,"Stolen Drama, Thriller The five-month-old baby of impoverished tribal woman Jhumpa Mahato is stolen. Two brothers, Gautam and Raman, who witness the kidnapping, try to help her and become embroiled in the complexities of the investigation. hi",/xR5Endhjm4soY6fPgXY0jrpDZvL.jpg,7
Kacche,"Kacche Drama Jay and Yash, two best friends, have their final conversation before one of them departs to Canada for further studies, which sets them on a humorous yet emotional path exploring love, egos, and understanding. hi",/Ab1WspJZGli2aUuCUn3hm9Fq2f7.jpg,7
Love and Cocoa,"Love and Cocoa Romance It's the story of a beautiful silence of love, an unwelcome awkwardness, and two sweethearts, 'Ved' and 'Priya meeting after 4 long years. The film depicts the meaning, significance, and the value of time, with the revelation that you can never unlove someone; all you have to do is believe and speak your heart out. hi",/a5WkHtjwgwgopzSGzpvB1y3ytVc.jpg,4
Akelli,"Akelli Action, Drama, Thriller An Indian woman fights to survive in war-torn Iraq. hi",/4eBiqmlak6K5nipdayoGRYH2ON5.jpg,3
Ghoomer,"Ghoomer Drama Anina, a young woman batting prodigy, loses her right hand in an unfortunate accident on the eve of her international cricketing debut. An unsympathetic, failed and frustrated cricketer enters her life, gives her a new dream and transforms her fate by the most innovative training, to make her play for the Indian cricket team again, as a bowler. hi",/6npQ0MxlmCqPPF8H5xK4yGt7ZLL.jpg,5
Mushaira,"Mushaira Mystery, Drama Mubeen receives an invitation of Mushaira organized by Abida in Dilbara Kothi Aligarh. There he falls in love with Abida, but finally he comes to know that she was a spirit. A Stranger reveals the whole story of Abida's past life and all her family members and poets, who attended the last Mushaira organized around 25-year back. In the next birth Abida and Mubeen finally meet forever as Ada and Shantanu in modern life. The Movie is full of heart touching poetries (Shayari), melodious Songs, loving dialogues and suspense. hi",/9JrDdTEKjSNE6zEAtPexzPxqR66.jpg,4
Kill,"Kill Action, Crime, Thriller, Drama When an army commando finds out his true love is engaged against her will, he boards a New Dehli-bound train in a daring quest to derail the arranged marriage. But when a gang of knife-wielding thieves begin to terrorize innocent passengers on his train, the commando takes them on, one by one. hi",/m2zXTuNPkywdYLyWlVyJZW2QOJH.jpg,3
Nagumome Chaalu Le,"Nagumome Chaalu Le Romance, Drama A heartbroken Aparna and dumped Mark find solace together and decide to explore the city, holding onto a special book. As the night unfolds, they gradually heal and unknowingly develop feelings for each other. te",/3ON0VUxYa8gCEcMnO9jlELkcwJj.jpg,6
Friday Night Plan,"Friday Night Plan Comedy, Drama When their mother takes off on a business trip, two bickering brothers unite to secretly attend the hottest party of the year before she returns. hi",/8QIAFlELWwP8xfo2Xwf7oleDcUE.jpg,7
Vaan Moondru,"Vaan Moondru Drama, Romance, Family Revoles around 6 characters Sujith, Swaathi, Joshua, Jyothi Meenakshi, Siva and Chitra an how they express their love and admiration for each other and cross paths to lead together with a life full of love that’s irrespective of age and norms. ta",/umVjkLSJEKviuytIAwsoGL8rIND.jpg,4
Rakshak - India's Braves,"Rakshak - India's Braves Action, Drama, War The bravery of Lieutenant Triveni Singh, a young soldier who gave his own life to protect over 300 people who were caught in the cross firing at the Jammu railway station in a terrorist attack in 2004. hi",/yVBVV9CjlcHGYBJy5LqJOfs1KTB.jpg,7
Lost Ladies,"Lost Ladies Comedy, Drama, Romance In 2001, somewhere in rural India, two young brides get accidentally swapped on a train. In the ensuing chaos, they both encounter a host of colourful characters, resulting in hilarious and unexpected consequences. hi",/cGG5hCwPnMvuKzvUBnxo5y3DcVM.jpg,9
12th Fail,"12th Fail Drama Based on the true story of IPS officer Manoj Kumar Sharma, 12th Fail sheds limelight on fearlessly embracing the idea of restarting the academic journey despite the setbacks and challenges and reclaiming one's destiny at a place where millions of students attempt the world's toughest competitive exam: UPSC. hi",/eebUPRI4Z5e1Z7Hev4JZAwMIFkX.jpg,7
Blue Dogs,"Blue Dogs Drama, Crime The story of ‘blue dogs’ is about two watchful, loyal dogs of some supposed huge mobster, with his work in and around Mumbai. As the story unfolds, their lives of crime gets inexplicably tangled with bigotry, paranoia and delusions. hi",/nUZxNAdI4eAgUzySwffR01YjID6.jpg,3
Neru,"Neru Drama, Thriller 'Neru' is an enthralling legal and emotional drama that delves into the life of Sara, a blind sculpture artist on a quest for justice following a harrowing incident.  Against the backdrop of the Indian legal system, this gripping story takes viewers through a rollercoaster of emotions, unveiling layers of deceit and ultimately exploring themes of redemption. ml",/ktzJcMp4J1XssMgpZoQp0aFSrpC.jpg,7
Angaaragan,"Angaaragan Horror, Thriller This film is about mysterious events that unfold in a forest resort during a twelve-hour investigation in a non-linear play. The story revolves around a police officer who makes an unexpected visit to the resort. The investigation also opens up multiple hidden secrets of paranormal activities related to a late-Queen who was the first owner of this estate in which the resort is located. The investigation leads to invoking of further issues in the resort and what happens next is how the play is designed in the film ta",/kPByMKPM4rrOAys32pu76KYIDyu.jpg,8
Bramayugam,"Bramayugam Horror, Thriller, Drama A folk singer in 17th-century Kerala discovers a mansion. Inside, he encounters an enigmatic cook and a powerful master, setting in motion a chain of events that changes his life. ml",/snQLwRrfQAl5YFKVefZq9Lbscki.jpg,8
Rangoli,"Rangoli Family, Drama, Romance A School Boy Frequently Overcomes Uncertain Issues. Later Realize His Family Struggles Because of Him. ta",/iGkbrUo20knzN57sSicrf81r4q4.jpg,10
Sapta Sagaradaache Ello - Side B,"Sapta Sagaradaache Ello - Side B Romance, Drama, Thriller Manu is released from prison and strives to rekindle his love with Priya. kn",/7DIsSaRDmmyDViTwfl9RqV9zQTn.jpg,6
Sapta Sagaradaache Ello – Side A,"Sapta Sagaradaache Ello – Side A Romance, Drama In the heart of 'Sapta Sagaradaache Ello’ resides an ardent love story between Manu and Priya. Set in 2010, the couple hails from a middle-class background. Circumstances land Manu in jail, putting his relationship with Priya in jeopardy. kn",/qjvSMN5dhSh7cymjj6if2aJ4ejW.jpg,6
Jai Ganesh,"Jai Ganesh Drama, Thriller In the unforgiving shadows of sympathy, Ganesh Gangadharan, a paraplegic designer, wrestles with his inner demons, striving for a semblance of normalcy. ml",/5t06YuOR93cqD2egserG91MhD4X.jpg,7
Slum Dog Husband,"Slum Dog Husband Comedy, Drama Lacchi, a happy-go-lucky mall-business man's proposed marriage with his lover Mounica gets into trouble when father of his first wife Baby, who happens to be a dog files a case in court against Lacchi demanding alimony. te",/mmdZzRqg2vrlbc63sMJL5kz8HBk.jpg,9
Bastar: The Naxal Story,"Bastar: The Naxal Story Action, Crime, Drama, War Based on the Naxalite–Maoist insurgency in the Bastar district of Chhattisgarh, an army officer leads a mission to eradicate a group of Maoist separatist insurgents responsible for the massacre of a military troop. hi",/N6yYSmGHnT38plOCaadlVcQH02.jpg,3
Onnam Sakshi Parethan,"Onnam Sakshi Parethan Drama, Crime The movie narrates a story of a man who unknowingly involved in a situation, never expecting that to happen. He then loses even the opportunity to explain what happened, and how he tries to survive is the story. ml",/9lQYuJnN9RqQfDwGeeZ5s8z9naG.jpg,7
1134,"1134 Thriller Inspired from real ATM robberies that took place in Hyderabad, 1134 is the story of a series of sequential ATM robberies that have a pattern. Will the robbers be caught? te",/xANawC6PTCjUnaiEhfEQw0lzRMx.jpg,7
Partner,"Partner Comedy, Science Fiction To solve their monetary issues, two friends go on a mission to steal a chip from a scientist, one of them falls trap to one of his scientific experiments, transforming into a woman. ta",/wpL2iA6xYEWKZudrX0Tup6iliNe.jpg,1
